[
  {
    "id": "seed-01",
    "name": "Metro Manila Subway Project (MMSP) Phase 1",
    "type": "rail",
    "status": "under_construction",
    "implementing_agency": "DOTr",
    "concessionaire": null,
    "funding_modality": "ODA",
    "region": "NCR",
    "provinces": ["Metro Manila"],
    "estimated_completion": "2029-12-31",
    "completion_confidence": "delayed_likely",
    "cost_php_billions": 488.5,
    "geometry": {
      "type": "LineString",
      "coordinates": [
        [120.983, 14.730],
        [121.028, 14.690],
        [121.032, 14.677],
        [121.036, 14.655],
        [121.038, 14.645],
        [121.052, 14.641],
        [121.065, 14.627],
        [121.070, 14.614],
        [121.064, 14.588],
        [121.061, 14.575],
        [121.056, 14.558],
        [121.051, 14.540],
        [121.048, 14.525],
        [121.035, 14.511],
        [121.019, 14.496]
      ]
    },
    "description": "A 33.1-km underground rapid transit line with 17 stations running from East Valenzuela (Depot) in the north through Quezon City, Ortigas, and Bonifacio Global City to FTI/Bicutan in Taguig in the south. The project is approximately 54% complete as of early 2026, funded by JICA ODA loans, and is the Philippines' first subway system.",
    "sources": [
      {"label": "BusinessMirror – 54% complete, Feb 2026", "url": "https://businessmirror.com.ph/2026/02/13/japan-funded-metro-manila-subway-moves-ahead-of-sked-54-complete/"},
      {"label": "JICA – Additional financing press release", "url": "https://www.jica.go.jp/english/overseas/philippine/information/press/2025/LAMMSPCMH.html"},
      {"label": "Metro Manila Subway – Wikipedia", "url": "https://en.wikipedia.org/wiki/Metro_Manila_Subway"}
    ],
    "last_updated": "2026-04-17"
  },
  {
    "id": "seed-02",
    "name": "North–South Commuter Railway (NSCR)",
    "type": "rail",
    "status": "under_construction",
    "implementing_agency": "DOTr",
    "concessionaire": null,
    "funding_modality": "ODA",
    "region": "NCR",
    "provinces": ["Metro Manila", "Bulacan", "Pampanga", "Tarlac", "Laguna"],
    "estimated_completion": "2028-12-31",
    "completion_confidence": "delayed_likely",
    "cost_php_billions": 873.6,
    "geometry": {
      "type": "LineString",
      "coordinates": [
        [120.548, 15.478],
        [120.658, 15.241],
        [120.761, 15.129],
        [120.820, 14.963],
        [120.857, 14.894],
        [120.890, 14.844],
        [120.959, 14.814],
        [120.988, 14.799],
        [120.997, 14.776],
        [121.000, 14.749],
        [120.998, 14.714],
        [120.990, 14.673],
        [120.983, 14.647],
        [120.984, 14.617],
        [120.982, 14.596],
        [120.985, 14.571],
        [120.987, 14.537],
        [121.010, 14.470],
        [121.033, 14.413],
        [121.058, 14.300],
        [121.085, 14.213]
      ]
    },
    "description": "A 147-km elevated/at-grade/depressed commuter rail system with 37 stations running from New Clark City in Capas, Tarlac south through Pampanga, Bulacan, Metro Manila (Tutuban), and down to Calamba, Laguna. Funded primarily by JICA and ADB ODA loans, it is roughly 50% complete with the Manila–Malolos segment targeting partial launch by late 2026 or early 2027.",
    "sources": [
      {"label": "Inquirer – DOTr eyes 2026 partial completion", "url": "https://newsinfo.inquirer.net/2122240/dotr-secures-right-of-way-for-nscr-sites-eyes-2026-partial-completion"},
      {"label": "BusinessWorld – up to four-year delay seen, Apr 2025", "url": "https://www.bworldonline.com/economy/2025/04/10/665363/up-to-four-year-delay-seen-for-north-south-rail-project/"},
      {"label": "NSCR official project website", "url": "https://nscr.com.ph/about"}
    ],
    "last_updated": "2026-04-17"
  },
  {
    "id": "seed-03",
    "name": "MRT Line 7",
    "type": "rail",
    "status": "under_construction",
    "implementing_agency": "DOTr",
    "concessionaire": "SMC Mass Rail Transit 7, Inc. (San Miguel Corporation)",
    "funding_modality": "PPP",
    "region": "NCR",
    "provinces": ["Metro Manila", "Bulacan"],
    "estimated_completion": "2028-12-31",
    "completion_confidence": "delayed_likely",
    "cost_php_billions": 77.0,
    "geometry": {
      "type": "LineString",
      "coordinates": [
        [121.036, 14.652],
        [121.037, 14.651],
        [121.041, 14.648],
        [121.053, 14.650],
        [121.058, 14.657],
        [121.070, 14.661],
        [121.078, 14.671],
        [121.089, 14.678],
        [121.089, 14.691],
        [121.073, 14.697],
        [121.057, 14.704],
        [121.048, 14.710],
        [121.039, 14.725],
        [121.028, 14.760]
      ]
    },
    "description": "A 22.8-km elevated light rail transit line with 14 stations running from North Avenue station in Quezon City (interchange with MRT-3 and the Metro Manila Subway) along Commonwealth Avenue and Quirino Highway up to San Jose del Monte in Bulacan. It is a PPP project under San Miguel Corporation; 12 Quezon City stations are expected to open in 2025–2026, with the Tala and San Jose del Monte stations to follow by 2027–2028.",
    "sources": [
      {"label": "PPP Center – MRT-7 to open 12 stations by Q4 2025", "url": "https://ppp.gov.ph/in_the_news/mrt-7-to-open-12-stations-by-4th-quarter-2025/"},
      {"label": "GMA News – MRT-7 trains running by 2025, full ops by 2026", "url": "https://www.gmanetwork.com/news/money/companies/943569/mrt7-trains-running-by-2025-full-ops-by-2026-smc/story/"},
      {"label": "MRT Line 7 – Wikipedia", "url": "https://en.wikipedia.org/wiki/MRT_Line_7_(Metro_Manila)"}
    ],
    "last_updated": "2026-04-17"
  },
  {
    "id": "seed-04",
    "name": "LRT-1 Cavite Extension",
    "type": "rail",
    "status": "partially_operational",
    "implementing_agency": "LRTA",
    "concessionaire": "Light Rail Manila Corporation (LRMC)",
    "funding_modality": "Hybrid",
    "region": "NCR",
    "provinces": ["Metro Manila", "Cavite"],
    "estimated_completion": "2031-12-31",
    "completion_confidence": "delayed_likely",
    "cost_php_billions": 64.9,
    "geometry": {
      "type": "LineString",
      "coordinates": [
        [120.982, 14.539],
        [120.990, 14.527],
        [120.997, 14.518],
        [121.001, 14.508],
        [121.005, 14.499],
        [121.008, 14.488],
        [121.014, 14.478],
        [121.019, 14.464],
        [121.026, 14.449],
        [121.032, 14.437],
        [121.038, 14.422],
        [121.045, 14.407],
        [121.050, 14.393]
      ]
    },
    "description": "An approximately 14-km southward extension of LRT Line 1 from Baclaran in Pasay to Niog/Bacoor in Cavite, adding 11 new stations in three phases. Phase 1 (5 stations in Parañaque including Redemptorist-ASEANA, PITX, MIA Road, Ninoy Aquino Avenue, and Dr. Santos) was inaugurated on November 15, 2024 and is now operational; Phases 2 and 3 construction are set to resume in 2026 targeting full completion by 2031.",
    "sources": [
      {"label": "PCO – PBBM inaugurates LRT-1 Cavite Extension Phase 1", "url": "https://pco.gov.ph/news_releases/modernizing-phs-transit-system-pbbm-inaugurates-lrt-1-cavite-extension-phase-1/"},
      {"label": "LRMC – LRT-1 Cavite Extension project page", "url": "https://lrmc.ph/lrt-1-cavite-extension-project/"},
      {"label": "Inquirer – LRT-1 extension to Cavite operational by 2031", "url": "https://business.inquirer.net/474343/lrt-1-extension-to-cavite-operational-by-2031"}
    ],
    "last_updated": "2026-04-17"
  },
  {
    "id": "seed-05",
    "name": "MRT Line 4",
    "type": "rail",
    "status": "approved",
    "implementing_agency": "DOTr",
    "concessionaire": null,
    "funding_modality": "ODA",
    "region": "NCR",
    "provinces": ["Metro Manila", "Rizal"],
    "estimated_completion": "2031-12-31",
    "completion_confidence": "analyst_estimate",
    "cost_php_billions": 100.0,
    "geometry": {
      "type": "LineString",
      "coordinates": [
        [121.056, 14.597],
        [121.060, 14.598],
        [121.069, 14.598],
        [121.079, 14.594],
        [121.089, 14.591],
        [121.103, 14.589],
        [121.116, 14.587],
        [121.128, 14.579],
        [121.137, 14.572],
        [121.148, 14.566]
      ]
    },
    "description": "A 15.6-km elevated railway with 10 stations running from Ortigas Center (EDSA junction) in Pasig/Quezon City along Ortigas Avenue Extension east to Taytay in Rizal. Originally conceived as a monorail, the design was revised to conventional rail in 2022. The project received NEDA-ICC approval in December 2019, a US$1 billion ADB loan was signed in November 2024, and construction is targeted to begin in 2026 with full operations by 2031.",
    "sources": [
      {"label": "PNA – DOTr gets NEDA-ICC nod for MRT-4", "url": "https://www.pna.gov.ph/articles/1089786"},
      {"label": "ADB – Manila MRT Line 4 Project (53172-001)", "url": "https://www.adb.org/projects/53172-001/main"},
      {"label": "Philstar – MRT-4 funding may double to P100 billion", "url": "https://www.philstar.com/business/2025/05/26/2445732/mrt-4-funding-may-double-p100-billion"}
    ],
    "last_updated": "2026-04-17"
  },
  {
    "id": "seed-06",
    "name": "NLEX–SLEX Connector Road",
    "type": "expressway",
    "status": "under_construction",
    "implementing_agency": "DPWH",
    "concessionaire": "NLEX Corporation (MPTC)",
    "funding_modality": "PPP",
    "region": "NCR",
    "provinces": ["Metro Manila"],
    "estimated_completion": "2026-06-30",
    "completion_confidence": "delayed_likely",
    "cost_php_billions": 23.2,
    "geometry": {
      "type": "LineString",
      "coordinates": [
        [120.9829, 14.6648],
        [120.9835, 14.6590],
        [120.9841, 14.6530],
        [120.9848, 14.6472],
        [120.9852, 14.6420],
        [120.9858, 14.6368],
        [120.9862, 14.6318],
        [120.9868, 14.6270],
        [120.9872, 14.6220],
        [120.9876, 14.6170],
        [120.9880, 14.6125],
        [120.9885, 14.6080]
      ]